[
  {
    "id": "candidate-029",
    "title": "Zomato trims 600 jobs amid increasing automation",
    "url": "https://inc42.com/buzz/zomato-trims-600-jobs-amid-increasing-automation-quick-commerce-wars/",
    "source": "Inc42",
    "publishedDate": "2025-04-01",
    "excerpt": "Accessible title/text says Zomato trimmed 600 jobs amid increasing automation and quick-commerce wars.",
    "status": "approved",
    "duplicateOf": "zomato-2025-04-01",
    "notes": "Strong non-duplicate lead. Verify body quote before publishing. Promoted to verified public entry zomato-2025-04-01 on 2026-07-04."
  },
  {
    "id": "candidate-028",
    "title": "OpenText makes AI number-one priority as company slashes 1,600 jobs",
    "url": "https://betakit.com/opentext-makes-ai-number-one-priority-as-company-slashes-1600-jobs/",
    "source": "BetaKit",
    "publishedDate": "2025-05-06",
    "excerpt": "Accessible title/text says OpenText made AI its number-one priority as it slashed 1,600 jobs.",
    "status": "approved",
    "duplicateOf": "opentext-2025-05-06",
    "notes": "Strong non-duplicate lead. Verify quote and classify likely explicit_ai_cited or ai_adjacent_restructuring. Promoted to verified public entry opentext-2025-05-06 on 2026-07-04."
  },
  {
    "id": "candidate-027",
    "title": "Klue lays off 40% of staff as startup navigates shifting AI landscape",
    "url": "https://betakit.com/klue-lays-off-40-percent-of-staff-as-startup-faces-internal-and-external-ai-pressure/",
    "source": "BetaKit",
    "publishedDate": "2025-06-25",
    "excerpt": "Accessible title/text says Klue laid off 40% of staff as it navigated a shifting AI landscape; Layoffs.fyi listed 85 affected.",
    "status": "approved",
    "duplicateOf": "klue-2025-06-27",
    "notes": "Strong non-duplicate lead. Verify body quote before publishing. Promoted to verified public entry klue-2025-06-27 on 2026-07-04."
  },
  {
    "id": "candidate-026",
    "title": "King.com laid-off staff set to be replaced by AI tools they helped build",
    "url": "https://mobilegamer.biz/laid-off-king-staff-set-to-be-replaced-by-the-ai-tools-they-helped-build-say-sources/",
    "source": "Mobilegamer.biz",
    "publishedDate": "2025-07-14",
    "excerpt": "Accessible title/text says laid-off King staff were set to be replaced by the AI tools they helped build; Layoffs.fyi listed 200 affected.",
    "status": "approved",
    "duplicateOf": "king-2025-07-14",
    "notes": "Strong non-duplicate lead. Verify exact company name and body quote before publishing. Promoted to verified public entry king-2025-07-14 on 2026-07-04."
  },
  {
    "id": "candidate-025",
    "title": "BenchSci cuts 23% of jobs, becoming latest company to replace humans with AI",
    "url": "https://www.theglobeandmail.com/business/article-benchsci-job-cuts-replace-humans-with-ai/?intcmp=gift_share",
    "source": "The Globe and Mail",
    "publishedDate": "2025-08-12",
    "excerpt": "Accessible title says BenchSci cut 23% of jobs, becoming the latest company to replace humans with AI; Layoffs.fyi listed 83 affected.",
    "status": "approved",
    "duplicateOf": "benchsci-2025-08-12",
    "notes": "Strong non-duplicate lead. Verify body quote and paywall access before publishing. Promoted to verified public entry benchsci-2025-08-12 on 2026-07-04 using accessible T-Net/BC Technology metadata from the Globe-described item."
  },
  {
    "id": "candidate-024",
    "title": "Scope3 lays off staff as part of shift toward agentic advertising",
    "url": "https://finance.yahoo.com/news/exclusive-scope3-lays-off-staff-152235483.html",
    "source": "Yahoo Finance / Adweek",
    "publishedDate": "2025-09-05",
    "excerpt": "Yahoo-syndicated Adweek text says Scope3 laid off staff as part of a shift toward agentic advertising; affected commercial team as company expanded into AI offerings.",
    "status": "approved",
    "duplicateOf": "scope3-2025-09-05",
    "notes": "Strong non-duplicate lead. Original Adweek blocked, but Yahoo syndication/search text is accessible; confirm quote before publishing. Promoted to verified public entry scope3-2025-09-05 on 2026-07-04."
  },
  {
    "id": "candidate-023",
    "title": "Culture Amp lays off 6% globally as focus shifts to AI products",
    "url": "https://www.capitalbrief.com/article/culture-amp-lays-off-6-of-its-staff-globally-as-it-focuses-on-new-ai-products-3d5073ac-879a-4e01-9a08-a513ead8834b/",
    "source": "Capital Brief",
    "publishedDate": "2025-11-18",
    "excerpt": "Accessible title says Culture Amp laid off 6% of staff globally as focus shifted to new AI products; Layoffs.fyi listed 60 affected.",
    "status": "approved",
    "duplicateOf": "culture-amp-2025-11-18",
    "notes": "Strong non-duplicate lead. Verify article body and count before publishing. Promoted to verified public entry culture-amp-2025-11-18 on 2026-07-04."
  },
  {
    "id": "candidate-022",
    "title": "Yellow.ai lays off over 100 employees amid automation push",
    "url": "https://inc42.com/buzz/exclusive-yellow-ai-lays-off-over-100-employees-amid-automation-push/",
    "source": "Inc42",
    "publishedDate": "2025-12-23",
    "excerpt": "Accessible title/text says Yellow.ai laid off over 100 employees amid an automation push.",
    "status": "approved",
    "duplicateOf": "yellow-ai-2025-12-23",
    "notes": "Strong non-duplicate lead. Verify body quote before publishing. Promoted to verified public entry yellow-ai-2025-12-23 on 2026-07-04."
  },
  {
    "id": "candidate-021",
    "title": "Cars.com to lay off 11% of full-time workforce amid AI push",
    "url": "https://www.marketwatch.com/story/cars-com-to-lay-off-11-of-full-time-workforce-amid-ai-push-update-bb0c9f35",
    "source": "MarketWatch",
    "publishedDate": "2026-04-09",
    "excerpt": "Accessible title/text says Cars.com will lay off 11% of its full-time workforce amid an AI push.",
    "status": "approved",
    "duplicateOf": "cars-com-2026-04-09",
    "notes": "Strong non-duplicate lead. Verify current company naming and body quote before publishing. Promoted to verified public entry cars-com-2026-04-09 on 2026-07-04."
  },
  {
    "id": "candidate-020",
    "title": "Epidemic Sound to cut 150 jobs in AI pivot",
    "url": "https://www.marketscreener.com/news/eqt-backed-epidemic-sound-to-cut-150-jobs-in-ai-pivot-di-ce7f59dad18efe20",
    "source": "MarketScreener / Di",
    "publishedDate": "2026-04-21",
    "excerpt": "Accessible title/text says EQT-backed Epidemic Sound will cut 150 jobs in an AI pivot.",
    "status": "approved",
    "duplicateOf": "epidemic-sound-2026-04-21",
    "notes": "Strong non-duplicate lead. Verify source body and original Di context if possible. Promoted to verified public entry epidemic-sound-2026-04-21 on 2026-07-04."
  },
  {
    "id": "candidate-019",
    "title": "SuperOps lays off 30% of staff in AI-led restructuring push",
    "url": "https://inc42.com/buzz/superops-lays-off-30-staff-in-ai-led-restructuring-push/",
    "source": "Inc42",
    "publishedDate": "2026-04-24",
    "excerpt": "Accessible title/text says SuperOps laid off 30% of staff in an AI-led restructuring push; Layoffs.fyi listed 60 affected.",
    "status": "approved",
    "duplicateOf": "superops-2026-04-24",
    "notes": "Strong non-duplicate lead. Confirm count and body quote before publishing. Promoted to verified public entry superops-2026-04-24 on 2026-07-04."
  },
  {
    "id": "candidate-018",
    "title": "reAlpha reduces workforce by about 25% as AI advancements drive efficiency",
    "url": "https://markets.businessinsider.com/news/stocks/realpha-reduces-workforce-by-approximately-25-and-consolidates-vendor-spend-targeting-2-million-in-annualized-savings-as-ai-advancements-drive-organizational-efficiency-1036115751",
    "source": "Markets Insider / company release",
    "publishedDate": "2026-05-06",
    "excerpt": "Accessible title says reAlpha reduced workforce by approximately 25% and consolidated vendor spend as AI advancements drive organizational efficiency.",
    "status": "approved",
    "duplicateOf": "realpha-2026-05-06",
    "notes": "Strong non-duplicate primary/press-release style lead. Verify exact quote and classify likely explicit_ai_cited or automation_efficiency_cited. Promoted to verified public entry realpha-2026-05-06 on 2026-07-04."
  },
  {
    "id": "candidate-017",
    "title": "MRI Software cuts 200 jobs and cites AI adoption",
    "url": "https://propmodo.com/private-equity-backed-proptech-firm-cuts-200-jobs-cites-ai-adoption/",
    "source": "Propmodo",
    "publishedDate": "2026-05-11",
    "excerpt": "Accessible title/text: Private Equity-backed proptech firm cuts 200 jobs, cites AI adoption.",
    "status": "approved",
    "duplicateOf": "mri-software-2026-05-11",
    "notes": "Strong non-duplicate lead. Verify body quote and company details before publishing. Promoted to verified public entry mri-software-2026-05-11 on 2026-07-04."
  },
  {
    "id": "candidate-016",
    "title": "Kraken cuts 150 workers after deploying AI",
    "url": "https://financefeeds.com/kraken-cuts-150-staff-due-to-ai-delay-ipo-2027/",
    "source": "FinanceFeeds / Bloomberg",
    "publishedDate": "2026-05-18",
    "excerpt": "FinanceFeeds reports Bloomberg said Kraken laid off about 150 employees after deploying AI tools across operations that improved efficiency.",
    "status": "approved",
    "duplicateOf": "kraken-2026-05-15",
    "notes": "Strong non-duplicate lead with accessible Bloomberg syndication. Use FinanceFeeds as accessible reputable reporting or find another Bloomberg syndication. Promoted to verified public entry kraken-2026-05-15 on 2026-07-04."
  },
  {
    "id": "candidate-015",
    "title": "Interview Kickstart lays off nearly 50 amid AI automation push",
    "url": "https://inc42.com/buzz/blume-backed-interview-kickstart-lays-off-nearly-50-employees-amid-ai-automation-push/",
    "source": "Inc42",
    "publishedDate": "2026-05-29",